smartctl 7.4 2023-08-01 r5530 [x86_64-linux-synthetic] (local build)
Copyright (C) 2002-23, smartmontools developers

=== START OF INFORMATION SECTION ===
Device Model:     MARGROP LABS SYNTHETIC SATA 2TB
Serial Number:    SYNTHETIC-ATA-WARNING-0002
LU WWN Device Id: 0 000000 000000000
Firmware Version: SYN2
User Capacity:    2,000,398,934,016 bytes [2.00 TB]
Sector Sizes:     512 bytes logical, 4096 bytes physical
Rotation Rate:    7200 rpm
Form Factor:      3.5 inches
Device is:        Not in smartctl database 7.3/5528
ATA Version is:   ACS-3 T13/2161-D revision 5
SATA Version is:  SATA 3.3, 6.0 Gb/s
Local Time is:    Sat Jul 25 12:05:00 2026 UTC
SMART support is: Available - device has SMART capability.
SMART support is: Enabled

=== START OF READ SMART DATA SECTION ===
SMART overall-health self-assessment test result: PASSED

General SMART Values:
Offline data collection status:  (0x02) Offline data collection activity
                                        was completed without error.
Self-test execution status:      (  70) The previous self-test completed having
                                        the read element of the test failed.
Total time to complete Offline
data collection:                (  480) seconds.

SMART Attributes Data Structure revision number: 16
Vendor Specific SMART Attributes with Thresholds:
ID# ATTRIBUTE_NAME          FLAG     VALUE WORST THRESH TYPE      UPDATED  WHEN_FAILED RAW_VALUE
  5 Reallocated_Sector_Ct   0x0033   090   090   010    Pre-fail  Always       -       24
  9 Power_On_Hours          0x0032   074   074   000    Old_age   Always       -       16840
187 Reported_Uncorrect      0x0032   098   098   000    Old_age   Always       -       2
194 Temperature_Celsius     0x0022   058   050   000    Old_age   Always       -       42
197 Current_Pending_Sector  0x0012   099   099   000    Old_age   Always       -       3
198 Offline_Uncorrectable   0x0010   099   099   000    Old_age   Offline      -       1

SMART Error Log Version: 1
ATA Error Count: 2
  CR = 0x25, FR = 0x00, SC = 0x08, SN = 0x00, CL = 0x00, CH = 0x10
  ER = 0x40, ST = 0x51
  Error: UNC at LBA = 0x00100000 = 1048576

SMART Self-test log structure revision number 1
Num  Test_Description    Status                  Remaining  LifeTime(hours)  LBA_of_first_error
# 1  Extended offline    Completed: read failure       00%     16830         1048576
