smartctl 7.3 2022-02-28 r5338 [x86_64-linux-synthetic] (local build)
Copyright (C) 2002-22, smartmontools developers

=== START OF INFORMATION SECTION ===
Device Model:     MARGROP LABS SYNTHETIC VENDOR SSD 512GB
Serial Number:    SYNTHETIC-ATA-VENDOR-0003
LU WWN Device Id: 0 000000 000000000
Firmware Version: LAB3
User Capacity:    512,110,190,592 bytes [512 GB]
Sector Size:      512 bytes logical/physical
Rotation Rate:    Solid State Device
Form Factor:      2.5 inches
Device is:        Not in smartctl database 7.3/5319
ATA Version is:   ACS-4 T13/BSR INCITS 529 revision 5
SATA Version is:  SATA 3.4, 6.0 Gb/s
Local Time is:    Sat Jul 25 12:10:00 2026 UTC
SMART support is: Available - device has SMART capability.
SMART support is: Enabled

=== START OF READ SMART DATA SECTION ===
SMART overall-health self-assessment test result: PASSED

SMART Attributes Data Structure revision number: 16
Vendor Specific SMART Attributes with Thresholds:
ID# ATTRIBUTE_NAME          FLAG     VALUE WORST THRESH TYPE      UPDATED  WHEN_FAILED RAW_VALUE
  5 Reallocated_Sector_Ct   0x0033   100   100   010    Pre-fail  Always       -       0
  9 Power_On_Hours          0x0032   098   098   000    Old_age   Always       -       1450
170 Vendor_Health_Reserve   0x0033   085   085   010    Pre-fail  Always       -       85
171 Vendor_Program_Failures 0x0032   100   100   000    Old_age   Always       -       0
194 Temperature_Celsius     0x0022   070   060   000    Old_age   Always       -       30
241 Vendor_LBAs_Written     0x0032   100   100   000    Old_age   Always       -       123456

SMART Error Log Version: 1
No Errors Logged
