smartctl 7.4 2023-08-01 r5530 [x86_64-linux-synthetic] (local build)
Copyright (C) 2002-23, smartmontools developers

=== START OF INFORMATION SECTION ===
Model Number:                       MARGROP LABS SYNTHETIC NVME 1TB
Serial Number:                      SYNTHETIC-NVME-HEALTHY-0004
Firmware Version:                   NVH1
PCI Vendor/Subsystem ID:            0x0000
IEEE OUI Identifier:                0x000000
Total NVM Capacity:                 1,000,204,886,016 [1.00 TB]
Unallocated NVM Capacity:           0
Controller ID:                      1
NVMe Version:                       2.0
Number of Namespaces:               1
Namespace 1 Size/Capacity:          1,000,204,886,016 [1.00 TB]
Namespace 1 Formatted LBA Size:     512
Local Time is:                      Sat Jul 25 12:15:00 2026 UTC
Firmware Updates (0x02):            1 Slot
Optional Admin Commands (0x0017):   Security Format Frmw_DL Self_Test
Optional NVM Commands (0x005f):     Comp Wr_Unc DS_Mngmt Wr_Zero Sav/Sel_Feat
Log Page Attributes (0x1f):         S/H_per_NS Cmd_Eff_Lg Ext_Get_Lg Telmtry_Lg
Maximum Data Transfer Size:         512 Pages
Warning  Comp. Temp. Threshold:     84 Celsius
Critical Comp. Temp. Threshold:     88 Celsius

Supported Power States
St Op     Max   Active     Idle   RL RT WL WT  Ent_Lat  Ex_Lat
 0 +     8.00W       -        -    0  0  0  0        0       0

=== START OF SMART DATA SECTION ===
SMART overall-health self-assessment test result: PASSED

SMART/Health Information (NVMe Log 0x02)
Critical Warning:                   0x00
Temperature:                        35 Celsius
Available Spare:                    100%
Available Spare Threshold:          10%
Percentage Used:                    2%
Data Units Read:                    1,234,567 [632 GB]
Data Units Written:                 987,654 [505 GB]
Host Read Commands:                 7,654,321
Host Write Commands:                5,432,109
Controller Busy Time:               42
Power Cycles:                       12
Power On Hours:                     860
Unsafe Shutdowns:                   0
Media and Data Integrity Errors:    0
Error Information Log Entries:      0
Warning  Comp. Temperature Time:    0
Critical Comp. Temperature Time:    0

Error Information (NVMe Log 0x01, 16 of 256 entries)
No Errors Logged
